{
  "schema": 1,
  "note": "The How to play card (docs/ui/hud-spec.md section 17): every word it shows, as data, so a tone change or a translation is a data swap. Pages hold items; an item is an icon (drawn by UiHowto) and a line. The controls page draws each row's key or button from the player's own layout (data/input/layouts.json, through UiGlyphs), and skips a row the layout does not bind. Orb's direction for the copy: the player IS the fighter. Say bluntly what they control (fly, dodge, guard, light or heavy, power, signature, specials, transform) and what is automatic (no combo inputs: the blows and combos play out on their own). Never frame the player as directing someone else; 'director' and 'strategist' are internal words.",
  "title": "[ĤÖÖŴ ŢÖ PĹÅÅÝ]",
  "buttons": {
    "next": "[ÑÉXŢ]",
    "back": "[BÅÇĶ]",
    "done": "[ĜÖŢ ÎŢ]",
    "close": "[ÇĹÖŠÉ]"
  },
  "hint": "[ÉÉñţééŕ: ñééxţ   ÉÉšç: çĺööšéé ~]",
  "reopen": "[ÖÖpééñ ţĥííš ááĝááííñ fŕööm ţĥéé pááüüšéé mééñüü ööŕ F1. ]",
  "pages": [
    {
      "id": "idea",
      "title": "[Ŵĥááţ ýýöüü çööñţŕöĺ]",
      "items": [
        {
          "icon": "plan",
          "col": 0,
          "text": "[ÝÝööüü ááŕéé ţĥéé fííĝĥţééŕ. Fĺýý, ďööďĝéé, ĝüüááŕď, ĥííţ ĺííĝĥţ ööŕ ĥééáávýý, ĥööĺď pööŵééŕ, çááĺĺ ýýööüüŕ šííĝñááţüüŕéé, ţŕááñšfööŕm. Ţŕááñšfööŕm ŵĥééñ ţĥéé pŕöömpţ šĥööŵš: ýýööüü ĥííţ ĥááŕďééŕ fööŕ ţĥéé ŕééšţ ööf ţĥéé mááţçĥ. ~~~~~~~~~~~~~~~~~~]"
        },
        {
          "icon": "auto",
          "col": 0,
          "text": "[Ñöö çöömböö ííñpüüţš ţöö ĺééááŕñ. Bĺööŵš ááñď çöömbööš pĺááýý ööüüţ ööñ ţĥééííŕ ööŵñ. ~~~]"
        },
        {
          "icon": "body",
          "col": 0,
          "text": "[Ñöö ĥééááĺţĥ bááŕš. Ďáámááĝéé šĥööŵš ööñ ţĥéé bööďííééš. ~]"
        },
        {
          "icon": "finisher",
          "col": 0,
          "text": "[ÅÅ fííñííšĥííñĝ möövéé ééñďš ţĥéé fííĝĥţ, ñööţ áá çĺööçķ. ~~~]"
        },
        {
          "heading": "[ÝÝöüüŕ šţáñçé]",
          "col": 1
        },
        {
          "icon": "stance5_0",
          "col": 1,
          "text": "[Ñööţĥííñĝ ĥééĺď: ýýööüü fííĝĥţ ŵííţĥ mááŕţííááĺ ááŕţš. Ĥööĺď áá šĥööüüĺďééŕ büüţţööñ ţöö çĥááñĝéé šţááñçéé. ~~~~~~]"
        },
        {
          "icon": "stance5_2",
          "col": 1,
          "text": "[ÉÉááçĥ šţááñçéé çĥááñĝééš ŵĥááţ ýýööüüŕ fööüüŕ büüţţööñš ďöö: šéééé Šţááñçééš. ~~]"
        }
      ]
    },
    {
      "id": "controls",
      "title": "[Çööñţŕöĺš]",
      "device_label": {
        "kbd": "[Ķééýböáŕď]",
        "xbox": "[Çööñţŕööĺĺéŕ]",
        "ps": "[Çööñţŕööĺĺéŕ]",
        "switch": "[Çööñţŕööĺĺéŕ]",
        "deck": "[Çööñţŕööĺĺéŕ]",
        "generic": "[Çööñţŕööĺĺéŕ]",
        "touch": "[Ţöüçĥ]"
      },
      "items": [
        {
          "action": "move",
          "col": 0,
          "text": "[Fĺý]"
        },
        {
          "action": "light",
          "col": 0,
          "text": "[Ĺíĝĥţ]"
        },
        {
          "action": "heavy",
          "col": 0,
          "text": "[Ĥéávý]"
        },
        {
          "action": "signature",
          "col": 0,
          "text": "[Šííĝñááţüüŕéé (45 Çĥááŕĝéé)]"
        },
        {
          "action": "context",
          "col": 0,
          "text": "[ÅÅçţííööñ (ĝŕááb, ţĥŕööŵ: ííţ ďéépééñďš ööñ ýýööüüŕ šţááñçéé) ~~]"
        },
        {
          "action": "mode",
          "col": 0,
          "text": "[ÉÉñééŕĝýý (ĥööĺď; Šééţţííñĝš çááñ mááķéé ííţ áá ţööĝĝĺéé) ~~]"
        },
        {
          "action": "guard",
          "col": 1,
          "text": "[Ĝüüááŕď (ĥööĺď)]"
        },
        {
          "action": "dodge",
          "col": 1,
          "text": "[Ďööďĝéé (ţááp), špŕííñţ (ĥööĺď) ~~]"
        },
        {
          "action": "power",
          "col": 1,
          "text": "[Pööŵééŕ (ĥööĺď ţöö çĥááŕĝéé) ]"
        },
        {
          "action": "specials",
          "col": 1,
          "text": "[Špééçíáĺš]"
        },
        {
          "action": "transform",
          "col": 1,
          "text": "[Ţŕááñšfööŕm (ŵĥééñ ţĥéé pŕöömpţ šĥööŵš) ~~~~]"
        },
        {
          "action": "escape",
          "col": 1,
          "text": "[ÉÉšçáápéé (ĝééţ ööüüţ ööf áá fííĝĥţ)]"
        },
        {
          "action": "pause",
          "col": 1,
          "text": "[Páüšé]"
        },
        {
          "note": "kbd_p2",
          "col": 1,
          "text": "[Ţŵöö ööñ ööñéé ķééýýbööááŕď: P1 ĥááš ţĥéé ĺééfţ ķééýýš, P2 ţĥéé ŕííĝĥţ (ÎÎ Ĵ Ķ Ĺ ţöö fĺýý). Ţĥííš pááĝéé šĥööŵš ýýööüüŕš. ~~~~~~~~~~]"
        }
      ],
      "touch_items": [
        {
          "icon": "touch_move",
          "col": 0,
          "text": "[Ĺééfţ ţĥüümb: ţĥéé šţííçķ. Fĺííçķ ţöö ďööďĝéé, püüšĥ ööüüţ ţöö špŕííñţ. ~~~~~~~]"
        },
        {
          "icon": "touch_attack",
          "col": 0,
          "text": "[ÅÅţţááçķ: ţááp ĺííĝĥţ, ĥööĺď ĥééáávýý, šŵíípéé üüp fööŕ ýýööüüŕ šííĝñááţüüŕéé. ~~]"
        },
        {
          "icon": "stance_1",
          "col": 1,
          "text": "[Ĝüüááŕď: ĥööĺď.]"
        },
        {
          "icon": "touch_hold",
          "col": 1,
          "text": "[Pööŵééŕ: ĥööĺď ţöö çĥááŕĝéé. ]"
        },
        {
          "icon": "form",
          "col": 1,
          "text": "[Ţŕááñšfööŕm: ţĥéé büüţţööñ püüĺšééš ŵĥééñ áá fööŕm ííš ŕééááďýý. ~~~]"
        },
        {
          "icon": "stance_3",
          "col": 1,
          "text": "[ÉÉšçáápéé: šŵíípéé üüp ööñ Ĝüüáŕď.]"
        },
        {
          "icon": "touch_pause",
          "col": 1,
          "text": "[Pááüüšéé: ţĥéé ţööp büüţţööñ.]"
        }
      ]
    },
    {
      "id": "stances",
      "title": "[Šţááñçéš]",
      "items": [
        {
          "icon": "stances_table",
          "col": 0,
          "text": "[Ĥööĺď {defensive} (ďééfééñšíívéé), {energy} (ééñééŕĝýý), {charging} (çĥááŕĝííñĝ) ööŕ {manoeuvre} (mááñööééüüvŕéé) ţöö çĥááñĝéé šţááñçéé. Ĺééţ ĝöö ááñď ýýööüü ááŕéé bááçķ ííñ mááŕţííááĺ ááŕţš. ~~~~~~~~]"
        },
        {
          "icon": "stances_table_touch",
          "col": 0,
          "text": "[ÜÜšéé ţĥéé šţááñçéé büüţţööñš ţöö çĥááñĝéé šţááñçéé. Ĺééţ ĝöö ááñď ýýööüü ááŕéé bááçķ ííñ mááŕţííááĺ ááŕţš. ~~~]"
        },
        {
          "icon": "stances_full",
          "col": 0,
          "text": "[Ţááp áá šţááñçéé büüţţööñ ţöö üüšéé ííţ fööŕ ýýööüüŕ ñééxţ bĺööŵ, ööŕ ĥööĺď ííţ ţöö šţááýý ííñ ţĥéé šţááñçéé. ~~~~]"
        },
        {
          "icon": "stances_simple",
          "col": 0,
          "text": "[Ţĥéé ĝááméé pííçķš ýýööüüŕ šţááñçéé fööŕ ýýööü.]"
        }
      ]
    },
    {
      "id": "reads",
      "title": "[Ŕééááďííñĝ ţĥéé fííĝĥţ]",
      "items": [
        {
          "icon": "crown",
          "col": 0,
          "text": "[ÅÅ ŕííñĝ fĺáášĥééš ŵĥééñ pááŕţ ööf áá bööďýý ííš ĥüüŕţ mööŕéé, ááñď áá çááŕď šááýýš ŵĥííçĥ. ~~~~~]"
        },
        {
          "icon": "brink",
          "col": 0,
          "text": "[ÅÅ fááííñţ ŕííñĝ: ĥéé ííš ñééááŕĺýý bééááţééñ. ÅÅ fííñííšĥííñĝ möövéé çááñ ééñď ííţ. ~]"
        },
        {
          "icon": "reads",
          "col": 0,
          "text": "[Ŵááţçĥ ýýööüüŕ ŕíívááĺ: ĥííš šţááñçéé ááñď ĥííš fííñííšĥííñĝ möövéé. ~~]"
        },
        {
          "icon": "launch_info",
          "col": 0,
          "text": "[Ĝééţ ááñ ööpééñííñĝ, ţĥééñ pŕééšš ĺááüüñçĥ. ÎÎţ ŕééçĥááŕĝééš; üüñţííĺ ţĥééñ ííţ ööñĺýý ĥííţš ĥááŕď. ~~~~~~~]"
        },
        {
          "icon": "struggle",
          "col": 1,
          "text": "[Fííñííšĥííñĝ-möövéé ŕííñĝš: ĥööĺď ööŕ šĺííp. Ĝüüááŕď áá ĺááüüñçĥ, ďööďĝéé áá çĺööšéé-üüp ááţţááçķ, pŕééšš ţöö ááñšŵééŕ áá bééáám. ~~~~~~~~]"
        },
        {
          "icon": "toll",
          "col": 1,
          "text": "[Ţĥéé bööx ááţ ţĥéé ţööp çööüüñţš ţĥéé ďáámááĝéé ţöö ţĥéé ŵööŕĺď. ~~~]"
        },
        {
          "icon": "strip",
          "col": 1,
          "text": "[Ţĥéé šţŕííp ííš ţĥéé ŵĥööĺéé pĺááñééţ. ÎÎţ ŵŕáápš. ~~~]"
        },
        {
          "note": "reopen",
          "col": 1,
          "text": ""
        },
        {
          "icon": "first_run_about",
          "col": 1,
          "text": "[ÅÅbööüüţ ţĥííš ĝááméé ááñď ííţš ĺííçééñšééš: Pááüüšéé, ţĥééñ ÅÅbööüüţ. ]"
        }
      ]
    },
    {
      "id": "about",
      "title": "[Åböüţ]",
      "items": [
        {
          "col": 0,
          "text": "[Ĥööŵ ţĥííš ĝááméé ŵááš mááďéé. ÖÖŕb Çöömbááţ ÉÉX ííš áá ööñéé-pééŕšööñ pŕööĵééçţ: ÖÖŕb ďííŕééçţš ííţ ááñď büüííĺďš ííţ ŵííţĥ ÅÅÎÎ ţööööĺš. ÅÅÎÎ ţööööĺš ŵŕööţéé ţĥéé ĝááméé'š çööďéé ááñď ďŕááfţééď ííţš ááŕţ, ááñíímááţííööñ ďááţáá, ďííááĺööĝüüéé, ÜÜÎÎ ţééxţ ááñď ďééšííĝñ ďööçüümééñţš. ~~~~~~~~~~~~~~]"
        },
        {
          "icon": "about_music",
          "col": 0,
          "text": "[Ţĥéé müüšííç ŵááš ĝééñééŕááţééď ŵííţĥ Šüüñöö. ]"
        },
        {
          "icon": "about_voice",
          "col": 1,
          "text": "[Ţĥééŕéé ííš ñöö vööííçéé ááçţííñĝ. Çĥááŕááçţééŕ vööçááĺ šööüüñďš ááŕéé šýýñţĥééšííšééď býý çööďéé. ~]"
        },
        {
          "col": 1,
          "text": "[Ñööţĥííñĝ ííñ ţĥéé ĝááméé ííš ĝééñééŕááţééď býý ÅÅÎÎ ŵĥííĺéé ýýööüü pĺááýý: ííţš pŕööçééďüüŕááĺ šýýšţéémš (pĺááñééţš, fííĝĥţ çĥööŕééööĝŕáápĥýý, ţĥéé çöömpüüţééŕ-çööñţŕööĺĺééď ööppööñééñţ) ááŕéé ööŕďííñááŕýý çööďéé, ñööţ ÅÅÎÎ mööďééĺš. ÖÖŕb ďííŕééçţš ţĥéé pŕööĵééçţ, mááķééš ţĥéé çŕééááţíívéé ďééçííšííööñš, ááñď ţééšţš ááñď pĺááýýš ţĥéé ĝááméé. Ñöö pááŕţ ööf ţĥííš ĝááméé ííš ďééšçŕííbééď ááš ĥüümááñ-mááďéé üüñĺééšš ţĥííš pááĝéé šááýýš šöö. ~~~~~~~~~~~~~~~~~~~~~~~~]"
        }
      ]
    },
    {
      "id": "about_more",
      "title": "[Ĺííçééñšéé ááñď pŕíívááçý]",
      "items": [
        {
          "col": 0,
          "text": "[Ĺííçééñšéé: ñööţ çĥööšééñ ýýééţ. ÅÅĺĺ ŕííĝĥţš ŕééšééŕvééď fööŕ ñööŵ. ~~~]"
        },
        {
          "col": 0,
          "text": "[Mááďéé ŵííţĥ Ĝööďööţ ÉÉñĝííñéé. Çööpýýŕííĝĥţ (ç) 2014-pŕééšééñţ Ĝööďööţ ÉÉñĝííñéé çööñţŕííbüüţööŕš; çööpýýŕííĝĥţ (ç) 2007-2014 Ĵüüááñ Ĺííñííééţšķýý, ÅÅŕííééĺ Mááñžüüŕ. Ŕééĺééáášééď üüñďééŕ ţĥéé MÎÎŢ ĺííçééñšéé. ~~~~~~~~~~~~~~~]"
        },